{
  "_generated": "AUTO-GENERATED by scripts/gen_npu_ops.py -- DO NOT EDIT; regenerate: python3 scripts/gen_npu_ops.py",
  "applies_to": {
    "variant": "u55-u65",
    "products": [
      "ethos-u55",
      "ethos-u65"
    ],
    "toolchain": "vela",
    "toolchain_version": "5.2.0"
  },
  "op_namespace": "tflite",
  "authority": "tool-generated",
  "stance": "screening",
  "provenance": {
    "source": "vela --supported-ops-report, table '## Ethos-U55 and Ethos-U65 TFLite Summary Table' (column 1)",
    "tool_version": "vela 5.2.0",
    "content_hash": "md5:5f3168f3b3edb8b9dd6005088d4c5b31",
    "note": "SUPPORTED_OPS.md is invariant to --accelerator-config (verified by regenerating at ethos-u55-32, ethos-u55-256, ethos-u65-512, ethos-u85-128 and ethos-u85-2048: identical report). Only the TFLite table is used -- the TOSA tables in the same report are out of scope (scripts/alp_model/adapters/ethos_u.py accepts only src_format == \"tflite\"). A strict subset of the U85 table -- see u85@vela-*.json's supported_ops for the 17-op delta this SKU lacks."
  },
  "supported_ops": [
    "ABS",
    "ADD",
    "ARG_MAX",
    "AVERAGE_POOL_2D",
    "BATCH_MATMUL",
    "CONCATENATION",
    "CONV_2D",
    "DEPTHWISE_CONV_2D",
    "ELU",
    "EXP",
    "EXPAND_DIMS",
    "FULLY_CONNECTED",
    "GELU",
    "HARD_SWISH",
    "LEAKY_RELU",
    "LOG",
    "LOGISTIC",
    "MAXIMUM",
    "MAX_POOL_2D",
    "MEAN",
    "MINIMUM",
    "MIRROR_PAD",
    "MUL",
    "NEG",
    "PACK",
    "PAD",
    "PADV2",
    "PRELU",
    "QUANTIZE",
    "REDUCE_MAX",
    "REDUCE_MIN",
    "RELU",
    "RELU6",
    "RELU_0_TO_1",
    "RELU_N1_TO_1",
    "RESHAPE",
    "RESIZE_BILINEAR",
    "RESIZE_NEAREST_NEIGHBOR",
    "REVERSE_V2",
    "RSQRT",
    "SLICE",
    "SOFTMAX",
    "SPLIT",
    "SPLIT_V",
    "SQUARED_DIFFERENCE",
    "SQUEEZE",
    "STRIDED_SLICE",
    "SUB",
    "SUM",
    "TANH",
    "TILE",
    "TRANSPOSE",
    "TRANSPOSE_CONV",
    "UNIDIRECTIONAL_SEQUENCE_LSTM",
    "UNPACK"
  ]
}
