{
  "_generated": "AUTO-GENERATED by scripts/gen_npu_ops.py -- DO NOT EDIT; regenerate: python3 scripts/gen_npu_ops.py",
  "applies_to": {
    "variant": "u85",
    "products": [
      "ethos-u85"
    ],
    "toolchain": "vela",
    "toolchain_version": "5.1.0"
  },
  "op_namespace": "tflite",
  "authority": "tool-generated",
  "stance": "screening",
  "provenance": {
    "source": "vela --supported-ops-report, table '## Ethos-U85 TFLite Summary Table' (column 1)",
    "tool_version": "vela 5.1.0",
    "content_hash": "md5:93f186ba8653467e46751765d151c3bd",
    "note": "SUPPORTED_OPS.md is invariant to --accelerator-config (verified by regenerating at ethos-u55-32, ethos-u55-256, ethos-u65-512, ethos-u85-128 and ethos-u85-2048: identical report). Only the TFLite table is used -- the TOSA tables in the same report are out of scope (scripts/alp_model/adapters/ethos_u.py accepts only src_format == \"tflite\")."
  },
  "supported_ops": [
    "ABS",
    "ADD",
    "ARG_MAX",
    "AVERAGE_POOL_2D",
    "BATCH_MATMUL",
    "CAST",
    "CONCATENATION",
    "CONV_2D",
    "DEPTHWISE_CONV_2D",
    "DIV",
    "EQUAL",
    "EXP",
    "EXPAND_DIMS",
    "FULLY_CONNECTED",
    "GATHER",
    "GREATER",
    "GREATER_EQUAL",
    "HARD_SWISH",
    "LEAKY_RELU",
    "LESS",
    "LESS_EQUAL",
    "LOG",
    "LOGICAL_AND",
    "LOGICAL_NOT",
    "LOGICAL_OR",
    "LOGISTIC",
    "MAXIMUM",
    "MAX_POOL_2D",
    "MEAN",
    "MINIMUM",
    "MIRROR_PAD",
    "MUL",
    "NEG",
    "NOT_EQUAL",
    "PACK",
    "PAD",
    "PADV2",
    "PRELU",
    "QUANTIZE",
    "REDUCE_ALL",
    "REDUCE_ANY",
    "REDUCE_MAX",
    "REDUCE_MIN",
    "RELU",
    "RELU6",
    "RELU_0_TO_1",
    "RELU_N1_TO_1",
    "RESHAPE",
    "RESIZE_BILINEAR",
    "RESIZE_NEAREST_NEIGHBOR",
    "REVERSE_V2",
    "RSQRT",
    "SCATTER_ND",
    "SELECT",
    "SELECT_V2",
    "SLICE",
    "SOFTMAX",
    "SPLIT",
    "SPLIT_V",
    "SQUARED_DIFFERENCE",
    "SQUEEZE",
    "STRIDED_SLICE",
    "SUB",
    "SUM",
    "TANH",
    "TILE",
    "TRANSPOSE",
    "TRANSPOSE_CONV",
    "UNIDIRECTIONAL_SEQUENCE_LSTM",
    "UNPACK"
  ]
}
